{
  "schemaVersion": "1.0.0",
  "kind": "modifier-policy",
  "id": "coach-modifier-policy",
  "version": "1.0.0",
  "dimensionSetMajor": 1,
  "perDimensionBound": 3,
  "maxPositiveMovement": 10,
  "contextCategories": ["score-state", "match-period", "player-number-state", "opponent-phase-behavior", "evidence-availability"],
  "budgetNeutral": true
}
